<?xml version="1.0" encoding="UTF-8"?>
<breakfast_menu xmlns:xsi="http://www.w3.org/2001/XMLSchema-instance"
 xsi:noNamespaceSchemaLocation="menu.xsd">
    <food>
        <name>Belgian Waffles</name>
        <price unit="EUR">5.95</price>
        <calories>650</calories>
        <category>sweet</category>
    </food>
    <food>
        <name>Omelette</name>
        <price unit="EUR">4.50</price>
        <calories>300</calories>
        <category>salty</category>
    </food>
</breakfast_menu>
